{
  "spec_id": "SPEC-0063",
  "pipeline_phase": "spec-review",
  "phase_history": [
    {
      "phase": "spec-draft",
      "completed_at": "2026-09-27T12:55:08Z",
      "result": "ok"
    },
    {
      "phase": "spec-review",
      "completed_at": "2026-09-27T12:56:20Z",
      "result": "ok"
    }
  ],
  "blocking_issues": [],
  "conflict_report_ref": null,
  "override": null
}